{
  "profile_id": "acceptance-research-agent",
  "name": "Acceptance Research Agent",
  "description": "Registry-backed research worker for visual acceptance",
  "openclaw_agent_id": "backend",
  "default_skills": [
    "acceptance-research"
  ],
  "allowed_tools": [
    "web",
    "read"
  ],
  "disallowed_skills": [],
  "policy_tags": [
    "demo",
    "safe-local"
  ],
  "status": "active",
  "metadata": {
    "demo": "acceptance"
  },
  "created_at": "2026-06-07T17:04:37.853Z",
  "updated_at": "2026-06-07T17:04:37.853Z",
  "workspace_id": "default"
}
